2025-11-08 22:09:04,874 - INFO - Connected to database successfully
2025-11-08 22:09:04,874 - INFO - Starting ingestion from data/raw_dockets.json
2025-11-08 22:09:04,884 - INFO - Started ingestion run 1 for source: raw_dockets.json
2025-11-08 22:09:04,885 - INFO - Loaded 502 docket records
2025-11-08 22:09:04,909 - INFO - Created new court: S.D.N.Y (normalized: SDNY)
2025-11-08 22:09:04,912 - INFO - Created new judge: Hon. Maria Rodriguez (normalized: maria rodriguez)
2025-11-08 22:09:04,915 - INFO - Created new case type: civil
2025-11-08 22:09:04,931 - INFO - Created new court: N.D. Cal. (normalized: NDCAL)
2025-11-08 22:09:04,932 - INFO - Created new judge: Judge Sarah Chen (normalized: sarah chen)
2025-11-08 22:09:04,935 - INFO - Created new court: E.D.N.Y. (normalized: EDNY)
2025-11-08 22:09:04,936 - INFO - Created new judge: Hon. Michael Torres (normalized: michael torres)
2025-11-08 22:09:04,937 - INFO - Created new case type: criminal
2025-11-08 22:09:04,941 - INFO - Created new judge: Hon. David Kim (normalized: david kim)
2025-11-08 22:09:04,942 - INFO - Created new case type: employment
2025-11-08 22:09:04,945 - INFO - Created new court: N.D.Ill. (normalized: NDILL)
2025-11-08 22:09:04,946 - INFO - Created new judge: Judge Patricia Williams (normalized: patricia williams)
2025-11-08 22:09:04,950 - INFO - Created new court: C.D. Cal (normalized: CDCAL)
2025-11-08 22:09:04,951 - INFO - Created new judge: Hon. Jennifer Martinez (normalized: jennifer martinez)
2025-11-08 22:09:04,958 - INFO - Created new court: W.D. Wash. (normalized: WDWASH)
2025-11-08 22:09:04,959 - INFO - Created new judge: Judge Robert Lee (normalized: robert lee)
2025-11-08 22:09:04,962 - INFO - Created new court: S.D. Tex. (normalized: SDTEX)
2025-11-08 22:09:04,962 - INFO - Created new judge: Hon. Elizabeth Santos (normalized: elizabeth santos)
2025-11-08 22:09:04,963 - INFO - Created new case type: personal injury
2025-11-08 22:09:04,966 - INFO - Created new court: D. Mass. (normalized: DMASS)
2025-11-08 22:09:04,969 - INFO - Created new court: N.D.Ga. (normalized: NDGA)
2025-11-08 22:09:04,970 - INFO - Created new judge: Judge Thomas Anderson (normalized: thomas anderson)
2025-11-08 22:09:04,973 - INFO - Created new court: E.D. Va. (normalized: EDVA)
2025-11-08 22:09:04,974 - INFO - Created new judge: Hon. Richard Parker (normalized: richard parker)
2025-11-08 22:09:04,977 - INFO - Created new court: S.D.Fla. (normalized: SDFLA)
2025-11-08 22:09:04,978 - INFO - Created new judge: Hon. Linda Morrison (normalized: linda morrison)
2025-11-08 22:09:04,980 - INFO - Created new court: D.N.J. (normalized: DNJ)
2025-11-08 22:09:04,981 - INFO - Created new judge: Judge Amanda Foster (normalized: amanda foster)
2025-11-08 22:09:04,985 - INFO - Created new judge: Hon. Kevin Walsh (normalized: kevin walsh)
2025-11-08 22:09:04,987 - INFO - Created new court: N.D. Ohio (normalized: NDOHIO)
2025-11-08 22:09:04,988 - INFO - Created new judge: Judge Susan Wright (normalized: susan wright)
2025-11-08 22:09:04,991 - INFO - Created new court: W.D.N.Y. (normalized: WDNY)
2025-11-08 22:09:04,992 - INFO - Created new judge: Hon. Margaret Sullivan (normalized: margaret sullivan)
2025-11-08 22:09:04,995 - INFO - Created new court: S.D. Cal. (normalized: SDCAL)
2025-11-08 22:09:04,996 - INFO - Created new judge: Judge Christopher Moore (normalized: christopher moore)
2025-11-08 22:09:04,999 - INFO - Created new court: E.D. Mich. (normalized: EDMICH)
2025-11-08 22:09:05,000 - INFO - Created new judge: Hon. Daniel Cooper (normalized: daniel cooper)
2025-11-08 22:09:05,003 - INFO - Created new court: D. Ariz. (normalized: DARIZ)
2025-11-08 22:09:05,004 - INFO - Created new judge: Judge Maria Gonzalez (normalized: maria gonzalez)
2025-11-08 22:09:05,007 - INFO - Created new court: M.D. Fla. (normalized: MDFLA)
2025-11-08 22:09:05,011 - INFO - Created new court: N.D. Tex. (normalized: NDTEX)
2025-11-08 22:09:05,013 - INFO - Created new judge: Hon. Robert Jackson (normalized: robert jackson)
2025-11-08 22:09:05,016 - INFO - Created new judge: Judge William Bennett (normalized: william bennett)
2025-11-08 22:09:05,019 - INFO - Created new court: W.D. Pa. (normalized: WDPA)
2025-11-08 22:09:05,020 - INFO - Created new judge: Hon. Sandra Miller (normalized: sandra miller)
2025-11-08 22:09:05,023 - INFO - Created new court: D.D.C. (normalized: DDC)
2025-11-08 22:09:05,024 - INFO - Created new judge: Judge Anthony Rivera (normalized: anthony rivera)
2025-11-08 22:09:05,028 - INFO - Created new judge: Hon. Jessica Turner (normalized: jessica turner)
2025-11-08 22:09:05,031 - INFO - Created new court: E.D. La. (normalized: EDLA)
2025-11-08 22:09:05,031 - INFO - Created new judge: Judge Raymond Hughes (normalized: raymond hughes)
2025-11-08 22:09:05,034 - INFO - Created new court: D. Colo. (normalized: DCOLO)
2025-11-08 22:09:05,035 - INFO - Created new judge: Hon. Paul Mitchell (normalized: paul mitchell)
2025-11-08 22:09:05,039 - INFO - Created new court: S.D. Ind. (normalized: SDIND)
2025-11-08 22:09:05,040 - INFO - Created new judge: Judge Lisa Campbell (normalized: lisa campbell)
2025-11-08 22:09:05,043 - INFO - Created new court: M.D. N.C. (normalized: MDNC)
2025-11-08 22:09:05,044 - INFO - Created new judge: Hon. Charles Edwards (normalized: charles edwards)
2025-11-08 22:09:05,047 - INFO - Created new court: W.D. Mo. (normalized: WDMO)
2025-11-08 22:09:05,049 - INFO - Created new judge: Judge Brian Foster (normalized: brian foster)
2025-11-08 22:09:05,052 - INFO - Created new court: D. Or. (normalized: DOR)
2025-11-08 22:09:05,053 - INFO - Created new judge: Hon. Victoria Stone (normalized: victoria stone)
2025-11-08 22:09:05,057 - INFO - Created new judge: Judge Eric Collins (normalized: eric collins)
2025-11-08 22:09:05,060 - INFO - Created new judge: Hon. Michelle Carter (normalized: michelle carter)
2025-11-08 22:09:05,062 - INFO - Created new court: E.D. Wis. (normalized: EDWIS)
2025-11-08 22:09:05,063 - INFO - Created new judge: Judge Karen Peterson (normalized: karen peterson)
2025-11-08 22:09:05,066 - INFO - Created new court: M.D. Tenn. (normalized: MDTENN)
2025-11-08 22:09:05,067 - INFO - Created new judge: Hon. Steven Morris (normalized: steven morris)
2025-11-08 22:09:05,070 - INFO - Created new court: D.S.C. (normalized: DSC)
2025-11-08 22:09:05,071 - INFO - Created new judge: Judge Harold Simpson (normalized: harold simpson)
2025-11-08 22:09:05,075 - INFO - Created new judge: Hon. Gregory Allen (normalized: gregory allen)
2025-11-08 22:09:05,079 - INFO - Created new court: W.D. Ky. (normalized: WDKY)
2025-11-08 22:09:05,080 - INFO - Created new judge: Judge Rachel Thompson (normalized: rachel thompson)
2025-11-08 22:09:05,084 - INFO - Created new court: S.D. Iowa (normalized: SDIOWA)
2025-11-08 22:09:05,085 - INFO - Created new judge: Hon. Dorothy Lewis (normalized: dorothy lewis)
2025-11-08 22:09:05,089 - INFO - Created new court: E.D.N.C. (normalized: EDNC)
2025-11-08 22:09:05,090 - INFO - Created new judge: Judge Timothy Anderson (normalized: timothy anderson)
2025-11-08 22:09:05,095 - INFO - Created new court: D. Nev. (normalized: DNEV)
2025-11-08 22:09:05,096 - INFO - Created new judge: Hon. Angela Russell (normalized: angela russell)
2025-11-08 22:09:05,100 - INFO - Created new court: M.D. Ala. (normalized: MDALA)
2025-11-08 22:09:05,101 - INFO - Created new judge: Judge Nicholas Hayes (normalized: nicholas hayes)
2025-11-08 22:09:05,104 - INFO - Created new court: N.D. W.Va. (normalized: NDWVA)
2025-11-08 22:09:05,106 - INFO - Created new judge: Hon. Patricia Barnes (normalized: patricia barnes)
2025-11-08 22:09:05,109 - INFO - Created new court: S.D. Miss. (normalized: SDMISS)
2025-11-08 22:09:05,110 - INFO - Created new judge: Judge Franklin Pierce (normalized: franklin pierce)
2025-11-08 22:09:05,114 - INFO - Created new court: E.D. Ark. (normalized: EDARK)
2025-11-08 22:09:05,115 - INFO - Created new judge: Hon. Melissa Gray (normalized: melissa gray)
2025-11-08 22:09:05,118 - INFO - Created new judge: Judge Howard Price (normalized: howard price)
2025-11-08 22:09:05,120 - INFO - Created new court: D. Idaho (normalized: DIDAHO)
2025-11-08 22:09:05,121 - INFO - Created new judge: Hon. Rebecca Wood (normalized: rebecca wood)
2025-11-08 22:09:05,124 - INFO - Created new court: M.D. Pa. (normalized: MDPA)
2025-11-08 22:09:05,125 - INFO - Created new judge: Judge Walter Coleman (normalized: walter coleman)
2025-11-08 22:09:05,129 - INFO - Created new court: N.D. Ala. (normalized: NDALA)
2025-11-08 22:09:05,131 - INFO - Created new court: S.D. W.Va. (normalized: SDWVA)
2025-11-08 22:09:05,132 - INFO - Created new judge: Hon. Eugene Carter (normalized: eugene carter)
2025-11-08 22:09:05,135 - INFO - Created new court: E.D. Ky. (normalized: EDKY)
2025-11-08 22:09:05,136 - INFO - Created new judge: Judge Pamela Brooks (normalized: pamela brooks)
2025-11-08 22:09:05,139 - INFO - Created new court: W.D. La. (normalized: WDLA)
2025-11-08 22:09:05,141 - INFO - Created new judge: Hon. Ronald Jenkins (normalized: ronald jenkins)
2025-11-08 22:09:05,144 - INFO - Created new court: D. Mont. (normalized: DMONT)
2025-11-08 22:09:05,145 - INFO - Created new judge: Judge Lawrence Murphy (normalized: lawrence murphy)
2025-11-08 22:09:05,149 - INFO - Created new court: N.D. Okla. (normalized: NDOKLA)
2025-11-08 22:09:05,150 - INFO - Created new judge: Hon. Catherine Walsh (normalized: catherine walsh)
2025-11-08 22:09:05,154 - INFO - Created new court: S.D. Ala. (normalized: SDALA)
2025-11-08 22:09:05,155 - INFO - Created new judge: Judge Albert Richardson (normalized: albert richardson)
2025-11-08 22:09:05,158 - INFO - Created new court: E.D. Mo. (normalized: EDMO)
2025-11-08 22:09:05,159 - INFO - Created new judge: Hon. Sandra Phillips (normalized: sandra phillips)
2025-11-08 22:09:05,163 - INFO - Created new court: M.D. Ga. (normalized: MDGA)
2025-11-08 22:09:05,164 - INFO - Created new judge: Judge Marcus Sullivan (normalized: marcus sullivan)
2025-11-08 22:09:05,167 - INFO - Created new court: W.D. Okla. (normalized: WDOKLA)
2025-11-08 22:09:05,168 - INFO - Created new judge: Hon. Dennis Howard (normalized: dennis howard)
2025-11-08 22:09:05,171 - INFO - Created new court: D. Kan. (normalized: DKAN)
2025-11-08 22:09:05,172 - INFO - Created new judge: Judge Marilyn Tucker (normalized: marilyn tucker)
2025-11-08 22:09:05,175 - INFO - Created new court: N.D. Miss. (normalized: NDMISS)
2025-11-08 22:09:05,176 - INFO - Created new judge: Hon. Vincent Ross (normalized: vincent ross)
2025-11-08 22:09:05,179 - INFO - Created new court: S.D. Ohio (normalized: SDOHIO)
2025-11-08 22:09:05,180 - INFO - Created new judge: Judge Donald Peterson (normalized: donald peterson)
2025-11-08 22:09:05,184 - INFO - Created new court: E.D. Tenn. (normalized: EDTENN)
2025-11-08 22:09:05,185 - INFO - Created new judge: Hon. Barbara Kennedy (normalized: barbara kennedy)
2025-11-08 22:09:05,189 - INFO - Created new court: M.D. La. (normalized: MDLA)
2025-11-08 22:09:05,190 - INFO - Created new judge: Judge Henry Wallace (normalized: henry wallace)
2025-11-08 22:09:05,193 - INFO - Created new court: W.D. Ark. (normalized: WDARK)
2025-11-08 22:09:05,194 - INFO - Created new judge: Hon. Charles Murphy (normalized: charles murphy)
2025-11-08 22:09:05,197 - INFO - Created new court: N.D. Iowa (normalized: NDIOWA)
2025-11-08 22:09:05,198 - INFO - Created new judge: Judge Laura Mitchell (normalized: laura mitchell)
2025-11-08 22:09:05,203 - INFO - Created new court: E.D. Okla. (normalized: EDOKLA)
2025-11-08 22:09:05,204 - INFO - Created new judge: Hon. Gerald Foster (normalized: gerald foster)
2025-11-08 22:09:05,208 - INFO - Created new judge: Judge Caroline Hughes (normalized: caroline hughes)
2025-11-08 22:09:05,210 - INFO - Created new court: W.D. Tenn. (normalized: WDTENN)
2025-11-08 22:09:05,211 - INFO - Created new judge: Hon. Joyce Bennett (normalized: joyce bennett)
2025-11-08 22:09:05,214 - INFO - Created new court: D. Wyo. (normalized: DWYO)
2025-11-08 22:09:05,215 - INFO - Created new judge: Judge Russell Cooper (normalized: russell cooper)
2025-11-08 22:09:05,218 - INFO - Created new court: N.D. Fla. (normalized: NDFLA)
2025-11-08 22:09:05,219 - INFO - Created new judge: Hon. Michael Warren (normalized: michael warren)
2025-11-08 22:09:05,222 - INFO - Created new court: S.D. Ga. (normalized: SDGA)
2025-11-08 22:09:05,222 - INFO - Created new judge: Judge Arthur Lewis (normalized: arthur lewis)
2025-11-08 22:09:05,225 - INFO - Created new court: E.D. Wash. (normalized: EDWASH)
2025-11-08 22:09:05,226 - INFO - Created new judge: Hon. Susan Martinez (normalized: susan martinez)
2025-11-08 22:09:05,230 - INFO - Created new judge: Judge Beverly Clark (normalized: beverly clark)
2025-11-08 22:09:05,232 - INFO - Created new court: W.D. Mich. (normalized: WDMICH)
2025-11-08 22:09:05,233 - INFO - Created new judge: Hon. Jeffrey Stone (normalized: jeffrey stone)
2025-11-08 22:09:05,236 - INFO - Created new court: N.D. Ind. (normalized: NDIND)
2025-11-08 22:09:05,237 - INFO - Created new judge: Judge Norman Russell (normalized: norman russell)
2025-11-08 22:09:05,241 - INFO - Created new court: E.D. Cal (normalized: EDCAL)
2025-11-08 22:09:05,242 - INFO - Created new judge: Hon. Patricia Wong (normalized: patricia wong)
2025-11-08 22:09:05,244 - INFO - Created new judge: Judge Lawrence Dixon (normalized: lawrence dixon)
2025-11-08 22:09:05,248 - INFO - Created new judge: Hon. Craig Anderson (normalized: craig anderson)
2025-11-08 22:09:05,250 - INFO - Created new court: W.D. Va. (normalized: WDVA)
2025-11-08 22:09:05,251 - INFO - Created new judge: Judge Emily Rogers (normalized: emily rogers)
2025-11-08 22:09:05,254 - INFO - Created new court: D.N.M. (normalized: DNM)
2025-11-08 22:09:05,257 - INFO - Created new judge: Hon. Margaret Hill (normalized: margaret hill)
2025-11-08 22:09:05,260 - INFO - Created new judge: Judge Philip Sanders (normalized: philip sanders)
2025-11-08 22:09:05,264 - INFO - Created new judge: Hon. Ronald Graham (normalized: ronald graham)
2025-11-08 22:09:05,269 - INFO - Created new court: W.D. N.C. (normalized: WDNC)
2025-11-08 22:09:05,270 - INFO - Created new judge: Hon. Kenneth Barnes (normalized: kenneth barnes)
2025-11-08 22:09:05,275 - INFO - Created new judge: Judge Victoria Palmer (normalized: victoria palmer)
2025-11-08 22:09:05,278 - INFO - Created new judge: Hon. Sharon Mitchell (normalized: sharon mitchell)
2025-11-08 22:09:05,281 - INFO - Created new judge: Judge Helen Carter (normalized: helen carter)
2025-11-08 22:09:05,284 - INFO - Created new judge: Hon. Curtis Reynolds (normalized: curtis reynolds)
2025-11-08 22:09:05,287 - INFO - Created new judge: Judge Roger Coleman (normalized: roger coleman)
2025-11-08 22:09:05,290 - INFO - Created new court: D. Utah (normalized: DUTAH)
2025-11-08 22:09:05,290 - INFO - Created new judge: Hon. Bruce Peterson (normalized: bruce peterson)
2025-11-08 22:09:05,294 - INFO - Created new judge: Judge Stephanie Long (normalized: stephanie long)
2025-11-08 22:09:05,297 - INFO - Created new judge: Hon. Christine Wagner (normalized: christine wagner)
2025-11-08 22:09:05,301 - INFO - Created new judge: Judge Albert Morrison (normalized: albert morrison)
2025-11-08 22:09:05,305 - INFO - Created new judge: Hon. Frances Powell (normalized: frances powell)
2025-11-08 22:09:05,309 - INFO - Created new judge: Judge Mitchell Spencer (normalized: mitchell spencer)
2025-11-08 22:09:05,312 - INFO - Created new court: D. Neb. (normalized: DNEB)
2025-11-08 22:09:05,313 - INFO - Created new judge: Hon. Douglas Wright (normalized: douglas wright)
2025-11-08 22:09:05,315 - INFO - Created new judge: Judge Peter Collins (normalized: peter collins)
2025-11-08 22:09:05,322 - INFO - Processed 100/502 records... (inserted: 99, updated: 1, failed: 0)
2025-11-08 22:09:05,323 - INFO - Created new judge: Hon. Diane Russell (normalized: diane russell)
2025-11-08 22:09:05,326 - INFO - Created new judge: Judge Rachel Harrison (normalized: rachel harrison)
2025-11-08 22:09:05,339 - WARNING - Failed to process record 106: Could not parse date: 10-3-2024
2025-11-08 22:09:05,346 - WARNING - Failed to process record 109: Could not parse date: 4-5-2023
2025-11-08 22:09:05,375 - WARNING - Failed to process record 121: Could not parse date: 12-11-2025
2025-11-08 22:09:05,426 - WARNING - Failed to process record 146: Could not parse date: 10-3-2023
2025-11-08 22:09:05,437 - WARNING - Failed to process record 153: Could not parse date: 6-6-2025
2025-11-08 22:09:05,444 - WARNING - Failed to process record 156: Could not parse date: 7-17-2022
2025-11-08 22:09:05,454 - WARNING - Failed to process record 159: Could not parse date: 3-1-2025
2025-11-08 22:09:05,466 - WARNING - Failed to process record 165: Could not parse date: 8-8-2024
2025-11-08 22:09:05,480 - WARNING - Failed to process record 172: Could not parse date: 9-25-2022
2025-11-08 22:09:05,484 - WARNING - Failed to process record 173: Could not parse date: 11-1-2025
2025-11-08 22:09:05,529 - WARNING - Failed to process record 196: Could not parse date: 8-8-2025
2025-11-08 22:09:05,539 - INFO - Processed 200/502 records... (inserted: 188, updated: 1, failed: 11)
2025-11-08 22:09:05,555 - WARNING - Failed to process record 209: Could not parse date: 8-8-2024
2025-11-08 22:09:05,560 - WARNING - Failed to process record 212: Could not parse date: 5-11-2024
2025-11-08 22:09:05,568 - WARNING - Failed to process record 216: Could not parse date: 2-21-2024
2025-11-08 22:09:05,569 - WARNING - Failed to process record 217: Could not parse date: 9-18-2025
2025-11-08 22:09:05,582 - WARNING - Failed to process record 223: Could not parse date: 6-2-2025
2025-11-08 22:09:05,600 - WARNING - Failed to process record 229: Could not parse date: 7-7-2025
2025-11-08 22:09:05,613 - WARNING - Failed to process record 235: Could not parse date: 5-22-2025
2025-11-08 22:09:05,623 - WARNING - Failed to process record 241: Could not parse date: 2-12-2024
2025-11-08 22:09:05,643 - WARNING - Failed to process record 250: Could not parse date: 4-20-2025
2025-11-08 22:09:05,661 - WARNING - Failed to process record 255: Could not parse date: 10-18-2025
2025-11-08 22:09:05,676 - WARNING - Failed to process record 259: Could not parse date: 9-20-2022
2025-11-08 22:09:05,698 - WARNING - Failed to process record 270: Could not parse date: 5-23-2025
2025-11-08 22:09:05,712 - WARNING - Failed to process record 277: Could not parse date: 7-25-2022
2025-11-08 22:09:05,714 - WARNING - Failed to process record 278: Could not parse date: 3-7-2024
2025-11-08 22:09:05,729 - WARNING - Failed to process record 285: Could not parse date: 3-18-2023
2025-11-08 22:09:05,735 - WARNING - Failed to process record 286: Could not parse date: 5-21-2023
2025-11-08 22:09:05,743 - WARNING - Failed to process record 290: Could not parse date: 7-24-2023
2025-11-08 22:09:05,764 - INFO - Processed 300/502 records... (inserted: 271, updated: 1, failed: 28)
2025-11-08 22:09:05,765 - WARNING - Failed to process record 301: Could not parse date: 12-19-2024
2025-11-08 22:09:05,771 - WARNING - Failed to process record 304: Could not parse date: 7-19-2022
2025-11-08 22:09:05,777 - WARNING - Failed to process record 307: Could not parse date: 4-2-2025
2025-11-08 22:09:05,779 - WARNING - Failed to process record 308: Could not parse date: 1-23-2024
2025-11-08 22:09:05,782 - WARNING - Failed to process record 310: Could not parse date: 1-5-2024
2025-11-08 22:09:05,801 - WARNING - Failed to process record 318: Could not parse date: 8-25-2025
2025-11-08 22:09:05,807 - WARNING - Failed to process record 320: Could not parse date: 11-17-2024
2025-11-08 22:09:05,812 - WARNING - Failed to process record 321: Could not parse date: 2-15-2025
2025-11-08 22:09:05,821 - WARNING - Failed to process record 323: Could not parse date: 2-7-2025
2025-11-08 22:09:05,829 - WARNING - Failed to process record 327: Could not parse date: 11-4-2023
2025-11-08 22:09:05,841 - WARNING - Failed to process record 333: Could not parse date: 4-12-2024
2025-11-08 22:09:05,842 - WARNING - Failed to process record 334: Could not parse date: 2-15-2022
2025-11-08 22:09:05,852 - WARNING - Failed to process record 339: Could not parse date: 8-8-2024
2025-11-08 22:09:05,865 - WARNING - Failed to process record 346: Could not parse date: 5-1-2023
2025-11-08 22:09:05,875 - WARNING - Failed to process record 352: Could not parse date: 9-19-2023
2025-11-08 22:09:05,877 - WARNING - Failed to process record 353: Could not parse date: 9-1-2023
2025-11-08 22:09:05,881 - WARNING - Failed to process record 355: Could not parse date: 11-6-2022
2025-11-08 22:09:05,883 - WARNING - Failed to process record 356: Could not parse date: 11-20-2022
2025-11-08 22:09:05,909 - WARNING - Failed to process record 370: Could not parse date: 7-13-2025
2025-11-08 22:09:05,936 - WARNING - Failed to process record 386: Could not parse date: 10-3-2022
2025-11-08 22:09:05,941 - WARNING - Failed to process record 389: Could not parse date: 11-27-2024
2025-11-08 22:09:05,959 - WARNING - Failed to process record 397: Could not parse date: 8-8-2025
2025-11-08 22:09:05,961 - WARNING - Failed to process record 398: Could not parse date: 2-15-2025
2025-11-08 22:09:05,965 - INFO - Processed 400/502 records... (inserted: 348, updated: 1, failed: 51)
2025-11-08 22:09:05,972 - WARNING - Failed to process record 404: Could not parse date: 9-15-2025
2025-11-08 22:09:05,988 - WARNING - Failed to process record 410: Could not parse date: 2-13-2022
2025-11-08 22:09:06,005 - WARNING - Failed to process record 418: Could not parse date: 4-7-2023
2025-11-08 22:09:06,007 - WARNING - Failed to process record 419: Could not parse date: 5-19-2023
2025-11-08 22:09:06,011 - WARNING - Failed to process record 422: Could not parse date: 3-19-2022
2025-11-08 22:09:06,021 - WARNING - Failed to process record 426: Could not parse date: 3-22-2024
2025-11-08 22:09:06,024 - WARNING - Failed to process record 428: Could not parse date: 9-9-2022
2025-11-08 22:09:06,026 - WARNING - Failed to process record 429: Could not parse date: 11-4-2023
2025-11-08 22:09:06,029 - WARNING - Failed to process record 431: Could not parse date: 7-12-2022
2025-11-08 22:09:06,035 - WARNING - Failed to process record 434: Could not parse date: 3-2-2023
2025-11-08 22:09:06,040 - WARNING - Failed to process record 437: Could not parse date: 6-5-2025
2025-11-08 22:09:06,046 - WARNING - Failed to process record 441: Could not parse date: 1-5-2023
2025-11-08 22:09:06,055 - WARNING - Failed to process record 446: Could not parse date: 10-13-2023
2025-11-08 22:09:06,062 - WARNING - Failed to process record 450: Could not parse date: 1-23-2022
2025-11-08 22:09:06,069 - WARNING - Failed to process record 454: Could not parse date: 9-14-2024
2025-11-08 22:09:06,074 - WARNING - Failed to process record 457: Could not parse date: 8-23-2023
2025-11-08 22:09:06,093 - WARNING - Failed to process record 467: Could not parse date: 8-24-2024
2025-11-08 22:09:06,119 - WARNING - Failed to process record 480: Could not parse date: 12-13-2022
2025-11-08 22:09:06,121 - WARNING - Failed to process record 481: Could not parse date: 10-28-2025
2025-11-08 22:09:06,142 - WARNING - Failed to process record 494: Could not parse date: 12-11-2022
2025-11-08 22:09:06,143 - WARNING - Failed to process record 495: Could not parse date: 2-15-2022
2025-11-08 22:09:06,154 - INFO - Processed 500/502 records... (inserted: 427, updated: 1, failed: 72)
2025-11-08 22:09:06,159 - INFO - Finished ingestion run 1
2025-11-08 22:09:06,160 - INFO - ============================================================
2025-11-08 22:09:06,160 - INFO - INGESTION SUMMARY
2025-11-08 22:09:06,160 - INFO - ============================================================
2025-11-08 22:09:06,160 - INFO - Run ID: 1
2025-11-08 22:09:06,160 - INFO - Total read: 502
2025-11-08 22:09:06,161 - INFO - Inserted: 429
2025-11-08 22:09:06,161 - INFO - Updated: 1
2025-11-08 22:09:06,161 - INFO - Failed: 72
2025-11-08 22:09:06,161 - INFO - Quarantine file: /app/quarantine/ingest_run_1.jsonl
2025-11-08 22:09:06,162 - INFO - Database connection closed
2025-11-08 23:13:29,589 - INFO - Connected to database successfully
2025-11-08 23:13:29,589 - INFO - Starting ingestion from data/raw_dockets.json
2025-11-08 23:13:29,725 - INFO - Started ingestion run 2 for source: raw_dockets.json
2025-11-08 23:13:29,725 - INFO - Loaded 502 docket records
2025-11-08 23:13:30,425 - INFO - Processed 100/502 records... (inserted: 0, updated: 100, failed: 0)
2025-11-08 23:13:30,592 - INFO - Processed 200/502 records... (inserted: 11, updated: 189, failed: 0)
2025-11-08 23:13:30,772 - INFO - Processed 300/502 records... (inserted: 28, updated: 272, failed: 0)
2025-11-08 23:13:30,942 - INFO - Processed 400/502 records... (inserted: 51, updated: 349, failed: 0)
2025-11-08 23:13:31,100 - INFO - Processed 500/502 records... (inserted: 72, updated: 428, failed: 0)
2025-11-08 23:13:31,106 - INFO - Finished ingestion run 2
2025-11-08 23:13:31,106 - INFO - ============================================================
2025-11-08 23:13:31,106 - INFO - INGESTION SUMMARY
2025-11-08 23:13:31,106 - INFO - ============================================================
2025-11-08 23:13:31,106 - INFO - Run ID: 2
2025-11-08 23:13:31,107 - INFO - Total read: 502
2025-11-08 23:13:31,107 - INFO - Inserted: 72
2025-11-08 23:13:31,107 - INFO - Updated: 430
2025-11-08 23:13:31,107 - INFO - Failed: 0
2025-11-08 23:13:31,107 - INFO - Database connection closed
